{
  "blocking_errors": [],
  "generated_at": "2026-05-06T23:38:11Z",
  "milestone_1b_detected": true,
  "milestone_2a_detected": true,
  "next_steps": [
    "Milestones 3B, 4A, and 4B now build on this parallel-readiness foundation.",
    "Use docs/final_demo_runbook.md for the final demo path.",
    "Do not add new architecture during final report and presentation packaging."
  ],
  "required_contracts_present": true,
  "required_docs_present": true,
  "status": "PASSED",
  "track_a_ready": true,
  "track_b_ready": true,
  "warnings": []
}
